{
  "$schema": "../icon.schema.json",
  "contributors": [
    "ferhadsultan"
  ],
  "tags": [
    "presentation",
    "point",
    "files",
    "documents"
  ],
  "categories": [
    "Files & Documents"
  ],
  "aliases": [],
  "deprecated": false,
  "motion": {
    "trigger": "hover",
    "mechanic": "point",
    "duration": 0.3,
    "ease": "easeOut",
    "stiffness": null
  }
}
