{
  "$schema": "../icon.schema.json",
  "contributors": [
    "ferhadsultan"
  ],
  "tags": [
    "bird",
    "flap",
    "animals"
  ],
  "categories": [
    "Animals"
  ],
  "aliases": [],
  "deprecated": false,
  "motion": {
    "trigger": "hover",
    "mechanic": "flap",
    "duration": 0.5,
    "ease": "easeInOut",
    "stiffness": null
  }
}
