{
  "$schema": "../icon.schema.json",
  "contributors": [
    "ferhadsultan"
  ],
  "tags": [
    "bar-chart2",
    "compare",
    "charts",
    "data"
  ],
  "categories": [
    "Charts & Data"
  ],
  "aliases": [],
  "deprecated": false,
  "motion": {
    "trigger": "tap",
    "mechanic": "compare",
    "duration": 0.3,
    "ease": "easeOut",
    "stiffness": null
  }
}
