{
  "$schema": "../icon.schema.json",
  "contributors": [
    "ferhadsultan"
  ],
  "tags": [
    "flag",
    "wave",
    "status",
    "alerts"
  ],
  "categories": [
    "Status & Alerts"
  ],
  "aliases": [],
  "deprecated": false,
  "motion": {
    "trigger": "hover",
    "mechanic": "wave",
    "duration": 0.6,
    "ease": "easeInOut",
    "stiffness": null
  }
}
