{
  "$schema": "../icon.schema.json",
  "contributors": [
    "ferhadsultan"
  ],
  "tags": [
    "percent",
    "orbit",
    "commerce",
    "finance"
  ],
  "categories": [
    "Commerce & Finance"
  ],
  "aliases": [],
  "deprecated": false,
  "motion": {
    "trigger": "hover",
    "mechanic": "orbit",
    "duration": 0.35,
    "ease": "easeOut",
    "stiffness": null
  }
}
