{
  "$schema": "../icon.schema.json",
  "contributors": [
    "ferhadsultan"
  ],
  "tags": [
    "milk",
    "pour",
    "food",
    "drink"
  ],
  "categories": [
    "Food & Drink"
  ],
  "aliases": [],
  "deprecated": false,
  "motion": {
    "trigger": "hover",
    "mechanic": "pour",
    "duration": 0.4,
    "ease": "easeOut",
    "stiffness": null
  }
}
