{
  "$schema": "../icon.schema.json",
  "contributors": [
    "ferhadsultan"
  ],
  "tags": [
    "gift",
    "unwrap",
    "commerce",
    "finance"
  ],
  "categories": [
    "Commerce & Finance"
  ],
  "aliases": [],
  "deprecated": false,
  "motion": {
    "trigger": "tap",
    "mechanic": "unwrap",
    "duration": 0.3,
    "ease": "backOut",
    "stiffness": null
  }
}
