{
  "$schema": "../icon.schema.json",
  "contributors": [
    "ferhadsultan"
  ],
  "tags": [
    "stethoscope",
    "listen",
    "health",
    "science"
  ],
  "categories": [
    "Health & Science"
  ],
  "aliases": [],
  "deprecated": false,
  "motion": {
    "trigger": "hover",
    "mechanic": "listen",
    "duration": 0.5,
    "ease": "easeInOut",
    "stiffness": null
  }
}
