{
  "$schema": "../icon.schema.json",
  "contributors": [
    "ferhadsultan"
  ],
  "tags": [
    "fish-symbol",
    "swim",
    "animals"
  ],
  "categories": [
    "Animals"
  ],
  "aliases": [],
  "deprecated": false,
  "motion": {
    "trigger": "hover",
    "mechanic": "swim",
    "duration": 0.6,
    "ease": "easeInOut",
    "stiffness": null
  }
}
