{
  "$schema": "../icon.schema.json",
  "contributors": [
    "ferhadsultan"
  ],
  "tags": [
    "clover",
    "wave",
    "weather",
    "nature"
  ],
  "categories": [
    "Weather & Nature"
  ],
  "aliases": [],
  "deprecated": false,
  "motion": {
    "trigger": "hover",
    "mechanic": "wave",
    "duration": 0.6,
    "ease": "easeInOut",
    "stiffness": null
  }
}
