{
  "$schema": "../icon.schema.json",
  "contributors": [
    "ferhadsultan"
  ],
  "tags": [
    "cake",
    "glow",
    "food",
    "drink"
  ],
  "categories": [
    "Food & Drink"
  ],
  "aliases": [],
  "deprecated": false,
  "motion": {
    "trigger": "hover",
    "mechanic": "glow",
    "duration": 0.5,
    "ease": "easeInOut",
    "stiffness": null
  }
}
