{
  "$schema": "../icon.schema.json",
  "contributors": [
    "ferhadsultan"
  ],
  "tags": [
    "battery-full",
    "charge",
    "devices",
    "tech"
  ],
  "categories": [
    "Devices & Tech"
  ],
  "aliases": [],
  "deprecated": false,
  "motion": {
    "trigger": "hover",
    "mechanic": "charge",
    "duration": 0.2,
    "ease": null,
    "stiffness": null
  }
}
