{
  "$schema": "../icon.schema.json",
  "contributors": [
    "ferhadsultan"
  ],
  "tags": [
    "kanban",
    "progress",
    "interface",
    "actions"
  ],
  "categories": [
    "Interface & Actions"
  ],
  "aliases": [],
  "deprecated": false,
  "motion": {
    "trigger": "hover",
    "mechanic": "progress",
    "duration": 0.4,
    "ease": "easeOut",
    "stiffness": null
  }
}
