{
  "$schema": "../icon.schema.json",
  "contributors": [
    "ferhadsultan"
  ],
  "tags": [
    "mars",
    "fly",
    "people",
    "body"
  ],
  "categories": [
    "People & Body"
  ],
  "aliases": [],
  "deprecated": false,
  "motion": {
    "trigger": "hover",
    "mechanic": "fly",
    "duration": 0.5,
    "ease": "easeOut",
    "stiffness": null
  }
}
